{
  "workflow_id": "charter:ea5b026b30fd5b30bf5f30d457817ba1c3120826005bbcb6745ef5f58678a5fe",
  "charter_id": "investor-research-to-linear-v1",
  "workflow_type": "OutcomeCharterWorkflow",
  "task_queue": "outcome-charters",
  "overall_timeout_seconds": 3600,
  "plan_ref": "sha256:1111111111111111111111111111111111111111111111111111111111111111",
  "inputs_ref": "sha256:2222222222222222222222222222222222222222222222222222222222222222",
  "capability_ref": "sha256:3333333333333333333333333333333333333333333333333333333333333333",
  "approval_ref": "sha256:4444444444444444444444444444444444444444444444444444444444444444",
  "definition_digest": "sha256:adf81aec23b4459a576c01664d2e1a97a318f2ea16c5377d845336d9fa358b7a",
  "execution_scope_digest": "sha256:ebc5437ab799b26b7c42ad29a2da31489565b13e766cd08bd5b05f25f83d7ab5",
  "preview_digest": "sha256:7777777777777777777777777777777777777777777777777777777777777777"
}
